room,order,category ,date,start_time,end_time,chairperson_name,chairperson_affiliation,commentators_name,commentators_affiliationA,1,QA・ECサイト,1,13:00,14:30,石川 博,首都大学東京,"鈴木 伸崇,清水 敏之","筑波大,京大"B,1,情報伝搬・クラウドソーシング,1,13:00,14:30,牛尼 剛聡 ,九州大学,"大島 裕明, 金政 泰彦","京都大学, 株式会社富士通研究所"C,1,食・レシピ情報,1,13:00,14:30,増永 良文,お茶の水女子大学,"都司 達夫, 藤原 靖宏","福井大学, 日本電信電話株式会社"D,1,トピック分類,1,13:00,14:30,横山 大作,東京大学,"土田 正明, 新妻 弘崇","日本電気株式会社, 岡山大学"A,2,テキストマイニング,1,14:15,16:15,関 洋平,筑波大学,"木村 昌臣, 土田 正明","芝浦工業大学, 日本電気株式会社"B,2,情報推薦,1,14:15,16:15,鈴木 優,奈良先端科学技術大学院大学,"欅 惇志, 宇津呂 武仁","東京工業大学, 宇津呂 武仁"